{
  "capabilities": {
    "chat": null,
    "reasoning": null,
    "tools": null,
    "vision": null
  },
  "description": "Observed LocalMaxxing leaderboard run. Evidence for compatibility, not an executable launch contract.",
  "engine": {
    "graph_mode": null,
    "name": "llama.cpp",
    "version": "b6997"
  },
  "facts": {
    "capabilities.chat": {
      "provenance": {
        "captured_at": "2026-08-30T09:10:02Z",
        "sources": [
          {
            "captured_at": "2026-08-30T09:10:02Z",
            "kind": "registry-enrichment",
            "url": "https://github.com/0xSero/local-ai-registry"
          }
        ]
      },
      "reason": "capability-not-verified",
      "state": "unknown"
    },
    "capabilities.reasoning": {
      "provenance": {
        "captured_at": "2026-08-30T09:10:02Z",
        "sources": [
          {
            "captured_at": "2026-08-30T09:10:02Z",
            "kind": "registry-enrichment",
            "url": "https://github.com/0xSero/local-ai-registry"
          }
        ]
      },
      "reason": "capability-not-verified",
      "state": "unknown"
    },
    "capabilities.tools": {
      "provenance": {
        "captured_at": "2026-08-30T09:10:02Z",
        "sources": [
          {
            "captured_at": "2026-08-30T09:10:02Z",
            "kind": "registry-enrichment",
            "url": "https://github.com/0xSero/local-ai-registry"
          }
        ]
      },
      "reason": "capability-not-verified",
      "state": "unknown"
    },
    "capabilities.vision": {
      "provenance": {
        "captured_at": "2026-08-30T09:10:02Z",
        "sources": [
          {
            "captured_at": "2026-08-30T09:10:02Z",
            "kind": "registry-enrichment",
            "url": "https://github.com/0xSero/local-ai-registry"
          }
        ]
      },
      "reason": "capability-not-verified",
      "state": "unknown"
    },
    "engine.graph_mode": {
      "provenance": {
        "captured_at": "2026-08-30T09:10:02Z",
        "sources": [
          {
            "captured_at": "2026-08-30T09:10:02Z",
            "kind": "registry-enrichment",
            "url": "https://github.com/0xSero/local-ai-registry"
          }
        ]
      },
      "reason": "runtime-detail-not-published",
      "state": "unknown"
    },
    "serving.kv_cache_tokens": {
      "provenance": {
        "captured_at": "2026-08-30T09:10:02Z",
        "sources": [
          {
            "captured_at": "2026-08-30T09:10:02Z",
            "kind": "registry-enrichment",
            "url": "https://github.com/0xSero/local-ai-registry"
          }
        ]
      },
      "reason": "kv-cache-capacity-not-published",
      "state": "unknown"
    },
    "serving.max_concurrency": {
      "provenance": {
        "captured_at": "2026-08-31T23:03:15Z",
        "sources": [
          {
            "captured_at": "2026-08-31T23:03:15Z",
            "kind": "source-semantics",
            "url": "https://www.localmaxxing.com/en/runs/cmokakk10000ajx04d0ij9xvn"
          }
        ]
      },
      "reason": "server-capacity-not-evidenced",
      "state": "unknown"
    }
  },
  "hardware_count": 1,
  "hardware_id": "ryzen-ai-max-plus-395-128gb",
  "id": "qwen3-6-27b-q4-k-xl-ryzen-ai-max-plus-395-128gb-llama-cpp-tp1-d0ij9xvn",
  "launch": {
    "container": {
      "captured_at": "2026-08-30T09:10:02Z",
      "compose_file": null,
      "digest": null,
      "image": null,
      "reason": "reference-only-launch",
      "runtime": null,
      "source": [
        {
          "captured_at": "2026-08-30T09:10:02Z",
          "kind": "recipe-launch",
          "url": "https://www.localmaxxing.com/en/runs/cmokakk10000ajx04d0ij9xvn"
        }
      ],
      "state": "none"
    },
    "kind": "reference",
    "run_id": "cmokakk10000ajx04d0ij9xvn",
    "source": "localmaxxing",
    "url": "https://www.localmaxxing.com/en/runs/cmokakk10000ajx04d0ij9xvn"
  },
  "metadata": {
    "localmaxxing": {
      "backend": "vulkan",
      "batch_size": 1,
      "hardware_label": "Ryzen AI Max 395",
      "notes": "Vulkan-RADV (Mesa) on AMD Strix Halo gfx1151. Speculative decoding with Qwen3.5-0.8B draft, draft-max=16. +36% decode at 1k context vs no-spec (12.4 -> 16.9 t/s). Note: spec decode regresses at long context (10k: 7.5 vs 7 t/s; 54k: 0.97 vs 10.9 t/s) due to draft KV scan cost. Crossover at ~5-8k tokens; production deploys without spec at 65k context.",
      "observed_command": "",
      "run_id": "cmokakk10000ajx04d0ij9xvn"
    }
  },
  "model_instance_id": "unsloth-qwen3-6-27b--q4-k-xl",
  "provenance": {
    "captured_at": "2026-08-30T09:10:02Z",
    "sources": [
      {
        "captured_at": "2026-08-30T09:10:02Z",
        "kind": "normalized-recipe",
        "url": "https://www.localmaxxing.com/en/runs/cmokakk10000ajx04d0ij9xvn"
      }
    ]
  },
  "recipe_source": "localmaxxing",
  "schema_version": "local-ai-registry/v1",
  "serving": {
    "kv_cache_tokens": null,
    "max_concurrency": null,
    "max_context_tokens": 65536,
    "tensor_parallel": 1
  },
  "speed_sweep_ids": [
    "qwen3-6-27b-q4-k-xl-ryzen-ai-max-plus-395-128gb-llama-cpp-tp1-d0ij9xvn-sweep"
  ],
  "status": "candidate"
}
