{
  "capabilities": {
    "chat": null,
    "reasoning": null,
    "tools": null,
    "vision": null
  },
  "description": "Observed LocalMaxxing leaderboard run. Evidence for compatibility, not an executable launch contract.",
  "engine": {
    "graph_mode": null,
    "name": "llama.cpp",
    "version": "db6844d (b117 ROCmFPX)"
  },
  "facts": {
    "capabilities.chat": {
      "provenance": {
        "captured_at": "2026-08-30T09:10:02Z",
        "sources": [
          {
            "captured_at": "2026-08-30T09:10:02Z",
            "kind": "registry-enrichment",
            "url": "https://github.com/0xSero/local-ai-registry"
          }
        ]
      },
      "reason": "capability-not-verified",
      "state": "unknown"
    },
    "capabilities.reasoning": {
      "provenance": {
        "captured_at": "2026-08-30T09:10:02Z",
        "sources": [
          {
            "captured_at": "2026-08-30T09:10:02Z",
            "kind": "registry-enrichment",
            "url": "https://github.com/0xSero/local-ai-registry"
          }
        ]
      },
      "reason": "capability-not-verified",
      "state": "unknown"
    },
    "capabilities.tools": {
      "provenance": {
        "captured_at": "2026-08-30T09:10:02Z",
        "sources": [
          {
            "captured_at": "2026-08-30T09:10:02Z",
            "kind": "registry-enrichment",
            "url": "https://github.com/0xSero/local-ai-registry"
          }
        ]
      },
      "reason": "capability-not-verified",
      "state": "unknown"
    },
    "capabilities.vision": {
      "provenance": {
        "captured_at": "2026-08-30T09:10:02Z",
        "sources": [
          {
            "captured_at": "2026-08-30T09:10:02Z",
            "kind": "registry-enrichment",
            "url": "https://github.com/0xSero/local-ai-registry"
          }
        ]
      },
      "reason": "capability-not-verified",
      "state": "unknown"
    },
    "engine.graph_mode": {
      "provenance": {
        "captured_at": "2026-08-30T09:10:02Z",
        "sources": [
          {
            "captured_at": "2026-08-30T09:10:02Z",
            "kind": "registry-enrichment",
            "url": "https://github.com/0xSero/local-ai-registry"
          }
        ]
      },
      "reason": "runtime-detail-not-published",
      "state": "unknown"
    },
    "serving.kv_cache_tokens": {
      "provenance": {
        "captured_at": "2026-08-30T09:10:02Z",
        "sources": [
          {
            "captured_at": "2026-08-30T09:10:02Z",
            "kind": "registry-enrichment",
            "url": "https://github.com/0xSero/local-ai-registry"
          }
        ]
      },
      "reason": "kv-cache-capacity-not-published",
      "state": "unknown"
    },
    "serving.max_concurrency": {
      "provenance": {
        "captured_at": "2026-08-31T23:03:15Z",
        "sources": [
          {
            "captured_at": "2026-08-31T23:03:15Z",
            "kind": "source-semantics",
            "url": "https://www.localmaxxing.com/en/runs/cms0ptvpi00b8s201pjwxa8rf"
          }
        ]
      },
      "reason": "server-capacity-not-evidenced",
      "state": "unknown"
    }
  },
  "hardware_count": 3,
  "hardware_id": "radeon-ai-pro-r9700-32gb",
  "id": "laguna-s-2-1-q4-0-rocmfp4-coherent-radeon-ai-pro-r9700-32gb-llama-cpp-tp3",
  "launch": {
    "container": {
      "captured_at": "2026-08-30T09:10:02Z",
      "compose_file": null,
      "digest": null,
      "image": null,
      "reason": "reference-only-launch",
      "runtime": null,
      "source": [
        {
          "captured_at": "2026-08-30T09:10:02Z",
          "kind": "recipe-launch",
          "url": "https://www.localmaxxing.com/en/runs/cms0ptvpi00b8s201pjwxa8rf"
        }
      ],
      "state": "none"
    },
    "kind": "reference",
    "run_id": "cms0ptvpi00b8s201pjwxa8rf",
    "source": "localmaxxing",
    "url": "https://www.localmaxxing.com/en/runs/cms0ptvpi00b8s201pjwxa8rf"
  },
  "metadata": {
    "localmaxxing": {
      "backend": "rocm",
      "batch_size": 1,
      "hardware_label": "Radeon AI Pro R9700",
      "notes": "HIP backend on 3x R9700 (gfx1201), agent profile: protects structured-output tensors, 4.51 bpw. Decode matches FAST, prefill -23%. llama-bench 5 reps.",
      "observed_command": "llama-bench -m Laguna-S-2.1-Q4_0_ROCMFP4_COHERENT-00001-of-00001.gguf -dev ROCm0/ROCm1/ROCm2 -ngl 999 -fa 1 -ctk f16 -ctv f16 -ts 0.78/1/1 -p 512 -n 64 -r 5",
      "run_id": "cms0ptvpi00b8s201pjwxa8rf",
      "tokenized": {
        "arguments": [
          "llama-bench",
          "-m",
          "Laguna-S-2.1-Q4_0_ROCMFP4_COHERENT-00001-of-00001.gguf",
          "-dev",
          "ROCm0/ROCm1/ROCm2",
          "-ngl",
          "999",
          "-fa",
          "1",
          "-ctk",
          "f16",
          "-ctv",
          "f16",
          "-ts",
          "0.78/1/1",
          "-p",
          "512",
          "-n",
          "64",
          "-r",
          "5"
        ],
        "fidelity": "faithful"
      }
    }
  },
  "model_instance_id": "poolside-laguna-s-2-1--q4-0-rocmfp4-coherent",
  "provenance": {
    "captured_at": "2026-08-30T09:10:02Z",
    "sources": [
      {
        "captured_at": "2026-08-30T09:10:02Z",
        "kind": "normalized-recipe",
        "url": "https://www.localmaxxing.com/en/runs/cms0ptvpi00b8s201pjwxa8rf"
      }
    ]
  },
  "recipe_source": "localmaxxing",
  "schema_version": "local-ai-registry/v1",
  "serving": {
    "kv_cache_tokens": null,
    "max_concurrency": null,
    "max_context_tokens": 2048,
    "tensor_parallel": 3
  },
  "speed_sweep_ids": [
    "laguna-s-2-1-q4-0-rocmfp4-coherent-radeon-ai-pro-r9700-32gb-llama-cpp-tp3-sweep"
  ],
  "status": "candidate"
}
