{
  "capabilities": {
    "chat": null,
    "reasoning": null,
    "tools": null,
    "vision": null
  },
  "description": "Measured compatibility from the local.ai Postgres publication. Launch arguments are not promoted into an executable contract.",
  "engine": {
    "graph_mode": null,
    "name": "llama.cpp",
    "version": "10017 (7dc1bfead)"
  },
  "facts": {
    "capabilities.chat": {
      "provenance": {
        "captured_at": "2026-08-27T06:04:13.773Z",
        "sources": [
          {
            "captured_at": "2026-08-27T06:04:13.773Z",
            "kind": "registry-enrichment",
            "url": "https://github.com/0xSero/local-ai-registry"
          }
        ]
      },
      "reason": "capability-not-verified",
      "state": "unknown"
    },
    "capabilities.reasoning": {
      "provenance": {
        "captured_at": "2026-08-27T06:04:13.773Z",
        "sources": [
          {
            "captured_at": "2026-08-27T06:04:13.773Z",
            "kind": "registry-enrichment",
            "url": "https://github.com/0xSero/local-ai-registry"
          }
        ]
      },
      "reason": "capability-not-verified",
      "state": "unknown"
    },
    "capabilities.tools": {
      "provenance": {
        "captured_at": "2026-08-27T06:04:13.773Z",
        "sources": [
          {
            "captured_at": "2026-08-27T06:04:13.773Z",
            "kind": "registry-enrichment",
            "url": "https://github.com/0xSero/local-ai-registry"
          }
        ]
      },
      "reason": "capability-not-verified",
      "state": "unknown"
    },
    "capabilities.vision": {
      "provenance": {
        "captured_at": "2026-08-27T06:04:13.773Z",
        "sources": [
          {
            "captured_at": "2026-08-27T06:04:13.773Z",
            "kind": "registry-enrichment",
            "url": "https://github.com/0xSero/local-ai-registry"
          }
        ]
      },
      "reason": "capability-not-verified",
      "state": "unknown"
    },
    "engine.graph_mode": {
      "provenance": {
        "captured_at": "2026-08-27T06:04:13.773Z",
        "sources": [
          {
            "captured_at": "2026-08-27T06:04:13.773Z",
            "kind": "registry-enrichment",
            "url": "https://github.com/0xSero/local-ai-registry"
          }
        ]
      },
      "reason": "runtime-detail-not-published",
      "state": "unknown"
    },
    "serving.kv_cache_tokens": {
      "provenance": {
        "captured_at": "2026-08-27T06:04:13.773Z",
        "sources": [
          {
            "captured_at": "2026-08-27T06:04:13.773Z",
            "kind": "registry-enrichment",
            "url": "https://github.com/0xSero/local-ai-registry"
          }
        ]
      },
      "reason": "kv-cache-capacity-not-published",
      "state": "unknown"
    }
  },
  "hardware_count": 1,
  "hardware_id": "apple-m4-max-36gb",
  "id": "pg-poolside-laguna-xs-2-1-gguf-laguna-xs-2-1-q4-k-m-gguf-unknown-apple-m4-max-36gb-llama-cpp-e9a7f6258f",
  "launch": {
    "container": {
      "captured_at": "2026-08-27T06:04:13.773Z",
      "compose_file": null,
      "digest": null,
      "image": null,
      "reason": "reference-only-launch",
      "runtime": null,
      "source": [
        {
          "captured_at": "2026-08-27T06:04:13.773Z",
          "kind": "recipe-launch",
          "url": "https://local.ai"
        }
      ],
      "state": "none"
    },
    "kind": "reference",
    "publication_id": "pg-20260827T060320709Z",
    "run_ids": [
      "01a02b83-923f-7f4e-9ce7-b2bfc63da0a7"
    ],
    "source": "exo-postgres"
  },
  "metadata": {
    "postgres": {
      "hardware_key": "m4_max_36_32c",
      "publication_id": "pg-20260827T060320709Z",
      "run_count": 1,
      "source_model_id": "poolside/Laguna-XS-2.1-GGUF/Laguna-XS-2.1-Q4_K_M.gguf"
    }
  },
  "model_instance_id": "poolside-laguna-xs-2-1-gguf--q4-k-m",
  "provenance": {
    "captured_at": "2026-08-27T06:04:13.773Z",
    "sources": [
      {
        "captured_at": "2026-08-27T06:04:13.773Z",
        "kind": "normalized-recipe",
        "url": "https://local.ai"
      }
    ]
  },
  "recipe_source": "exo-postgres",
  "schema_version": "local-ai-registry/v1",
  "serving": {
    "kv_cache_tokens": null,
    "max_concurrency": 1,
    "max_context_tokens": 32960,
    "tensor_parallel": 1
  },
  "speed_sweep_ids": [
    "pg-01a02b83-923f-7f4e-9ce7-b2bfc63da0a7-sweep"
  ],
  "status": "candidate"
}
