{
  "capabilities": {
    "chat": true,
    "reasoning": null,
    "tools": null,
    "vision": false
  },
  "description": "Candidate (MTP campaign 2026-09-22): attested tabbyapi-exl3 rebuilt on ExLlamaV3 1.5.1 (digest 0f83e619) and MTP drafting enabled in the config asset. Pending acceptance on the card.",
  "draft_launch": {
    "accelerator_backend": "nvidia",
    "arguments": [
      "main.py",
      "--config",
      "/app/config.yml"
    ],
    "container_port": 5000,
    "entrypoint": "/opt/venv/bin/python3",
    "environment": {
      "NVIDIA_VISIBLE_DEVICES": "all"
    },
    "host_port": 5000,
    "image": "ghcr.io/0xsero/tabbyapi-exl3@sha256:0f83e6198dc3be2561652d8df2525a7d1a69733e12fc8e25cbc5bc319a8a3ad1",
    "kind": "docker",
    "mounts": [
      {
        "read_only": true,
        "source": "${MODEL_ROOT}/qwen3-8-27b-exl3-4bpw",
        "target": "/workspace/models"
      },
      {
        "read_only": true,
        "source": "asset/qwen3827b-exl3-4bpw-256k-q4-tabbyapi-config.yml",
        "target": "/app/config.yml"
      }
    ],
    "shm_size": "8g",
    "synthesized": {
      "generated_at": "2026-09-22T17:44:53Z",
      "image_provenance": "qwen3827b-exl3-4bpw-rtx5090-tabbyapi-tp1",
      "template": "mtp-campaign-v1"
    }
  },
  "engine": {
    "graph_mode": "piecewise",
    "name": "tabbyapi",
    "version": "0.0.1+f07131cd"
  },
  "facts": {},
  "hardware_count": 1,
  "hardware_id": "rtx-5090-32gb",
  "id": "qwen3827b-exl3-4bpw-rtx5090-tabbyapi-tp1",
  "launch": {
    "container": {
      "captured_at": "2026-09-22T17:44:53Z",
      "compose_file": null,
      "digest": null,
      "image": null,
      "reason": "draft-pending-acceptance",
      "runtime": null,
      "source": [
        {
          "captured_at": "2026-09-22T17:44:53Z",
          "kind": "normalized-recipe",
          "url": "https://github.com/0xSero/local-ai-registry"
        }
      ],
      "state": "none"
    },
    "kind": "reference"
  },
  "metadata": {
    "image_provenance": {
      "attestation": "gh attestation verify oci://ghcr.io/0xsero/tabbyapi-exl3@sha256:0f83e6198dc3be2561652d8df2525a7d1a69733e12fc8e25cbc5bc319a8a3ad1 -o 0xSero",
      "dockerfile": "https://github.com/0xSero/local-ai-images/blob/825ff04535dfb9633ab08e1ac97b60fc5895fb76/tabbyapi-exl3/Dockerfile",
      "kind": "self-built-attested",
      "source": "https://github.com/0xSero/local-ai-images",
      "workflow": "https://github.com/0xSero/local-ai-images/actions/runs/35754016842"
    },
    "mtp_campaign": {
      "change": "attested tabbyapi-exl3 rebuilt on ExLlamaV3 1.5.1 (digest 0f83e619) and MTP drafting enabled in the config asset",
      "changed_at": "2026-09-22T17:44:53Z"
    },
    "previous_evidence": {
      "acceptance": {
        "accepted_at": "2026-09-02T23:52:12Z",
        "harness": "validate_rented.py on vast RTX 5090 (weights and config materialized in-container in place of the bind mounts)",
        "served_model_id": "Qwen3.8-27B-EXL3-4bpw"
      },
      "description": "Candidate: Qwen3.8-27B-EXL3-4bpw on one rtx-5090-32gb via TabbyAPI/ExLlamaV3, 262144 tokens, Q4 cache, bridge networking. Pending acceptance on the card.",
      "engine": {
        "graph_mode": "piecewise",
        "name": "tabbyapi",
        "version": "0.0.1+e632af41"
      },
      "facts": {},
      "launch_image": "ghcr.io/0xsero/tabbyapi-exl3@sha256:3d35e4979f5de7fd3b1621e4acd70035fa24ab78e941f4b569ab30fe1d1e7448",
      "launch_provenance": {
        "attestation": "gh attestation verify oci://ghcr.io/0xsero/tabbyapi-exl3@sha256:3d35e4979f5de7fd3b1621e4acd70035fa24ab78e941f4b569ab30fe1d1e7448 -o 0xSero",
        "dockerfile": "https://github.com/0xSero/local-ai-images/blob/main/tabbyapi-exl3/Dockerfile",
        "kind": "self-built-attested",
        "source": "https://github.com/0xSero/local-ai-images",
        "workflow": "https://github.com/0xSero/local-ai-images/actions/runs/33690503239"
      },
      "measurements": null,
      "note": "evidence for the launch before the MTP campaign 2026-09-22; kept for the before/after comparison, not acceptance evidence for the draft",
      "recommended": true,
      "speed_sweep_ids": [
        "qwen3827b-exl3-4bpw-rtx5090-tabbyapi-tp1-acceptance"
      ],
      "status": "validated"
    },
    "weights_subdir": "Qwen3.8-27B-EXL3-4bpw"
  },
  "model_instance_id": "turboderp-qwen3-8-27b-exl3--4-bpw",
  "provenance": {
    "captured_at": "2026-09-02T22:33:59Z",
    "sources": [
      {
        "captured_at": "2026-09-02T22:33:59Z",
        "kind": "normalized-recipe",
        "url": "https://github.com/0xSero/local-ai-registry"
      }
    ]
  },
  "recipe_source": "0xsero",
  "schema_version": "local-ai-registry/v1",
  "serving": {
    "kv_cache_tokens": 262144,
    "max_concurrency": 2,
    "max_context_tokens": 262144,
    "tensor_parallel": 1
  },
  "speed_sweep_ids": [],
  "status": "candidate"
}
