{
  "capabilities": {
    "chat": null,
    "reasoning": null,
    "tools": null,
    "vision": null
  },
  "description": "Measured compatibility from the local.ai Postgres publication. Launch arguments are not promoted into an executable contract.",
  "engine": {
    "graph_mode": null,
    "name": "llama.cpp",
    "version": "9591 (62061f910)"
  },
  "facts": {
    "capabilities.chat": {
      "provenance": {
        "captured_at": "2026-08-27T06:04:13.773Z",
        "sources": [
          {
            "captured_at": "2026-08-27T06:04:13.773Z",
            "kind": "registry-enrichment",
            "url": "https://github.com/0xSero/local-ai-registry"
          }
        ]
      },
      "reason": "capability-not-verified",
      "state": "unknown"
    },
    "capabilities.reasoning": {
      "provenance": {
        "captured_at": "2026-08-27T06:04:13.773Z",
        "sources": [
          {
            "captured_at": "2026-08-27T06:04:13.773Z",
            "kind": "registry-enrichment",
            "url": "https://github.com/0xSero/local-ai-registry"
          }
        ]
      },
      "reason": "capability-not-verified",
      "state": "unknown"
    },
    "capabilities.tools": {
      "provenance": {
        "captured_at": "2026-08-27T06:04:13.773Z",
        "sources": [
          {
            "captured_at": "2026-08-27T06:04:13.773Z",
            "kind": "registry-enrichment",
            "url": "https://github.com/0xSero/local-ai-registry"
          }
        ]
      },
      "reason": "capability-not-verified",
      "state": "unknown"
    },
    "capabilities.vision": {
      "provenance": {
        "captured_at": "2026-08-27T06:04:13.773Z",
        "sources": [
          {
            "captured_at": "2026-08-27T06:04:13.773Z",
            "kind": "registry-enrichment",
            "url": "https://github.com/0xSero/local-ai-registry"
          }
        ]
      },
      "reason": "capability-not-verified",
      "state": "unknown"
    },
    "engine.graph_mode": {
      "provenance": {
        "captured_at": "2026-08-27T06:04:13.773Z",
        "sources": [
          {
            "captured_at": "2026-08-27T06:04:13.773Z",
            "kind": "registry-enrichment",
            "url": "https://github.com/0xSero/local-ai-registry"
          }
        ]
      },
      "reason": "runtime-detail-not-published",
      "state": "unknown"
    },
    "serving.kv_cache_tokens": {
      "provenance": {
        "captured_at": "2026-08-27T06:04:13.773Z",
        "sources": [
          {
            "captured_at": "2026-08-27T06:04:13.773Z",
            "kind": "registry-enrichment",
            "url": "https://github.com/0xSero/local-ai-registry"
          }
        ]
      },
      "reason": "kv-cache-capacity-not-published",
      "state": "unknown"
    }
  },
  "hardware_count": 1,
  "hardware_id": "apple-m4-max-36gb",
  "id": "pg-prism-ml-bonsai-27b-gguf-bonsai-27b-q1-0-gguf-q1-0-apple-m4-max-36gb-llama-cpp-e8abf251d5",
  "launch": {
    "container": {
      "captured_at": "2026-08-27T06:04:13.773Z",
      "compose_file": null,
      "digest": null,
      "image": null,
      "reason": "reference-only-launch",
      "runtime": null,
      "source": [
        {
          "captured_at": "2026-08-27T06:04:13.773Z",
          "kind": "recipe-launch",
          "url": "https://local.ai"
        }
      ],
      "state": "none"
    },
    "kind": "reference",
    "publication_id": "pg-20260827T060320709Z",
    "run_ids": [
      "019f682c-f0ce-7071-a5e1-39a730ec1ac5",
      "019f682c-f0fe-7b93-912a-9642ad32189b",
      "019f9089-0e7f-7182-bee4-bae33aeb633f",
      "019f90a9-88f4-72e4-aeef-38c94d0ae653",
      "019fd7b6-17bd-7c8c-b034-6d9e6bdce6d6",
      "01a011ee-ea06-7fc1-8420-b33071769545",
      "01a011ee-ea31-74b7-b1d8-0d4150996e5b"
    ],
    "source": "exo-postgres"
  },
  "metadata": {
    "postgres": {
      "hardware_key": "m4_max_36_32c",
      "publication_id": "pg-20260827T060320709Z",
      "run_count": 7,
      "source_model_id": "prism-ml/Bonsai-27B-gguf/Bonsai-27B-Q1_0.gguf"
    }
  },
  "model_instance_id": "prism-ml-bonsai-27b-gguf-bonsai-27b-q1-0-gguf--q1-0",
  "provenance": {
    "captured_at": "2026-08-27T06:04:13.773Z",
    "sources": [
      {
        "captured_at": "2026-08-27T06:04:13.773Z",
        "kind": "normalized-recipe",
        "url": "https://local.ai"
      }
    ]
  },
  "recipe_source": "exo-postgres",
  "schema_version": "local-ai-registry/v1",
  "serving": {
    "kv_cache_tokens": null,
    "max_concurrency": 1,
    "max_context_tokens": 90048,
    "tensor_parallel": 1
  },
  "speed_sweep_ids": [
    "pg-019f682c-f0ce-7071-a5e1-39a730ec1ac5-sweep",
    "pg-019f682c-f0fe-7b93-912a-9642ad32189b-sweep",
    "pg-019f9089-0e7f-7182-bee4-bae33aeb633f-sweep",
    "pg-019f90a9-88f4-72e4-aeef-38c94d0ae653-sweep",
    "pg-019fd7b6-17bd-7c8c-b034-6d9e6bdce6d6-sweep",
    "pg-01a011ee-ea06-7fc1-8420-b33071769545-sweep",
    "pg-01a011ee-ea31-74b7-b1d8-0d4150996e5b-sweep"
  ],
  "status": "candidate"
}
