{
  "capabilities": {
    "chat": null,
    "reasoning": null,
    "tools": null,
    "vision": null
  },
  "description": "Observed LocalMaxxing leaderboard run. Evidence for compatibility, not an executable launch contract.",
  "engine": {
    "graph_mode": null,
    "name": "lmstudio",
    "version": null
  },
  "facts": {
    "capabilities.chat": {
      "provenance": {
        "captured_at": "2026-08-30T09:10:02Z",
        "sources": [
          {
            "captured_at": "2026-08-30T09:10:02Z",
            "kind": "registry-enrichment",
            "url": "https://github.com/0xSero/local-ai-registry"
          }
        ]
      },
      "reason": "capability-not-verified",
      "state": "unknown"
    },
    "capabilities.reasoning": {
      "provenance": {
        "captured_at": "2026-08-30T09:10:02Z",
        "sources": [
          {
            "captured_at": "2026-08-30T09:10:02Z",
            "kind": "registry-enrichment",
            "url": "https://github.com/0xSero/local-ai-registry"
          }
        ]
      },
      "reason": "capability-not-verified",
      "state": "unknown"
    },
    "capabilities.tools": {
      "provenance": {
        "captured_at": "2026-08-30T09:10:02Z",
        "sources": [
          {
            "captured_at": "2026-08-30T09:10:02Z",
            "kind": "registry-enrichment",
            "url": "https://github.com/0xSero/local-ai-registry"
          }
        ]
      },
      "reason": "capability-not-verified",
      "state": "unknown"
    },
    "capabilities.vision": {
      "provenance": {
        "captured_at": "2026-08-30T09:10:02Z",
        "sources": [
          {
            "captured_at": "2026-08-30T09:10:02Z",
            "kind": "registry-enrichment",
            "url": "https://github.com/0xSero/local-ai-registry"
          }
        ]
      },
      "reason": "capability-not-verified",
      "state": "unknown"
    },
    "engine.graph_mode": {
      "provenance": {
        "captured_at": "2026-08-30T09:10:02Z",
        "sources": [
          {
            "captured_at": "2026-08-30T09:10:02Z",
            "kind": "registry-enrichment",
            "url": "https://github.com/0xSero/local-ai-registry"
          }
        ]
      },
      "reason": "runtime-detail-not-published",
      "state": "unknown"
    },
    "serving.kv_cache_tokens": {
      "provenance": {
        "captured_at": "2026-08-30T09:10:02Z",
        "sources": [
          {
            "captured_at": "2026-08-30T09:10:02Z",
            "kind": "registry-enrichment",
            "url": "https://github.com/0xSero/local-ai-registry"
          }
        ]
      },
      "reason": "kv-cache-capacity-not-published",
      "state": "unknown"
    },
    "serving.max_concurrency": {
      "provenance": {
        "captured_at": "2026-08-31T23:03:15Z",
        "sources": [
          {
            "captured_at": "2026-08-31T23:03:15Z",
            "kind": "source-semantics",
            "url": "https://www.localmaxxing.com/en/runs/cmsxpucqz0ceams01npuuy82l"
          }
        ]
      },
      "reason": "server-capacity-not-evidenced",
      "state": "unknown"
    },
    "serving.max_context_tokens": {
      "provenance": {
        "captured_at": "2026-09-01T10:20:39Z",
        "sources": [
          {
            "captured_at": "2026-09-01T10:20:39Z",
            "kind": "source-semantics",
            "url": "https://www.localmaxxing.com/en/runs/cmsxpucqz0ceams01npuuy82l"
          }
        ]
      },
      "reason": "context-limit-not-evidenced",
      "state": "unknown"
    }
  },
  "hardware_count": 1,
  "hardware_id": "rtx-5090-32gb",
  "id": "gemma-4-26b-a4b-it-qat-q4-0-unquantized-q4-0-rtx-5090-32gb-lmstudio-tp1",
  "launch": {
    "container": {
      "captured_at": "2026-08-30T09:10:02Z",
      "compose_file": null,
      "digest": null,
      "image": null,
      "reason": "reference-only-launch",
      "runtime": null,
      "source": [
        {
          "captured_at": "2026-08-30T09:10:02Z",
          "kind": "recipe-launch",
          "url": "https://www.localmaxxing.com/en/runs/cmsxpucqz0ceams01npuuy82l"
        }
      ],
      "state": "none"
    },
    "kind": "reference",
    "run_id": "cmsxpucqz0ceams01npuuy82l",
    "source": "localmaxxing",
    "url": "https://www.localmaxxing.com/en/runs/cmsxpucqz0ceams01npuuy82l"
  },
  "metadata": {
    "localmaxxing": {
      "backend": null,
      "batch_size": 1,
      "hardware_label": "RTX 5090",
      "notes": null,
      "observed_command": "# Remote endpoint: http://127.0.0.1:1235  servedModel: google/gemma-4-26b-a4b-qat",
      "run_id": "cmsxpucqz0ceams01npuuy82l",
      "tokenized": {
        "endpoint": "http://127.0.0.1:1235",
        "fidelity": "faithful",
        "served_model_name": "google/gemma-4-26b-a4b-qat"
      }
    }
  },
  "model_instance_id": "google-gemma-4-26b-a4b-it-qat-q4-0-gguf--q4-0",
  "provenance": {
    "captured_at": "2026-08-30T09:10:02Z",
    "sources": [
      {
        "captured_at": "2026-08-30T09:10:02Z",
        "kind": "normalized-recipe",
        "url": "https://www.localmaxxing.com/en/runs/cmsxpucqz0ceams01npuuy82l"
      }
    ]
  },
  "recipe_source": "localmaxxing",
  "schema_version": "local-ai-registry/v1",
  "serving": {
    "kv_cache_tokens": null,
    "max_concurrency": null,
    "max_context_tokens": null,
    "tensor_parallel": 1
  },
  "speed_sweep_ids": [
    "gemma-4-26b-a4b-it-qat-q4-0-unquantized-q4-0-rtx-5090-32gb-lmstudio-tp1-sweep"
  ],
  "status": "candidate"
}
