{
  "capabilities": {
    "chat": null,
    "reasoning": null,
    "tools": null,
    "vision": null
  },
  "description": "Measured compatibility from the local.ai Postgres publication. Launch arguments are not promoted into an executable contract.",
  "engine": {
    "graph_mode": null,
    "name": "mlx",
    "version": "0.31.3"
  },
  "facts": {
    "capabilities.chat": {
      "provenance": {
        "captured_at": "2026-08-27T06:04:13.773Z",
        "sources": [
          {
            "captured_at": "2026-08-27T06:04:13.773Z",
            "kind": "registry-enrichment",
            "url": "https://github.com/0xSero/local-ai-registry"
          }
        ]
      },
      "reason": "capability-not-verified",
      "state": "unknown"
    },
    "capabilities.reasoning": {
      "provenance": {
        "captured_at": "2026-08-27T06:04:13.773Z",
        "sources": [
          {
            "captured_at": "2026-08-27T06:04:13.773Z",
            "kind": "registry-enrichment",
            "url": "https://github.com/0xSero/local-ai-registry"
          }
        ]
      },
      "reason": "capability-not-verified",
      "state": "unknown"
    },
    "capabilities.tools": {
      "provenance": {
        "captured_at": "2026-08-27T06:04:13.773Z",
        "sources": [
          {
            "captured_at": "2026-08-27T06:04:13.773Z",
            "kind": "registry-enrichment",
            "url": "https://github.com/0xSero/local-ai-registry"
          }
        ]
      },
      "reason": "capability-not-verified",
      "state": "unknown"
    },
    "capabilities.vision": {
      "provenance": {
        "captured_at": "2026-08-27T06:04:13.773Z",
        "sources": [
          {
            "captured_at": "2026-08-27T06:04:13.773Z",
            "kind": "registry-enrichment",
            "url": "https://github.com/0xSero/local-ai-registry"
          }
        ]
      },
      "reason": "capability-not-verified",
      "state": "unknown"
    },
    "engine.graph_mode": {
      "provenance": {
        "captured_at": "2026-08-27T06:04:13.773Z",
        "sources": [
          {
            "captured_at": "2026-08-27T06:04:13.773Z",
            "kind": "registry-enrichment",
            "url": "https://github.com/0xSero/local-ai-registry"
          }
        ]
      },
      "reason": "runtime-detail-not-published",
      "state": "unknown"
    },
    "serving.kv_cache_tokens": {
      "provenance": {
        "captured_at": "2026-08-27T06:04:13.773Z",
        "sources": [
          {
            "captured_at": "2026-08-27T06:04:13.773Z",
            "kind": "registry-enrichment",
            "url": "https://github.com/0xSero/local-ai-registry"
          }
        ]
      },
      "reason": "kv-cache-capacity-not-published",
      "state": "unknown"
    }
  },
  "hardware_count": 1,
  "hardware_id": "apple-m5-pro-64gb",
  "id": "pg-mlx-community-qwen3-5-9b-mlx-4bit-4bit-apple-m5-pro-64gb-mlx-649ac341dc",
  "launch": {
    "container": {
      "captured_at": "2026-08-27T06:04:13.773Z",
      "compose_file": null,
      "digest": null,
      "image": null,
      "reason": "reference-only-launch",
      "runtime": null,
      "source": [
        {
          "captured_at": "2026-08-27T06:04:13.773Z",
          "kind": "recipe-launch",
          "url": "https://local.ai"
        }
      ],
      "state": "none"
    },
    "kind": "reference",
    "publication_id": "pg-20260827T060320709Z",
    "run_ids": [
      "019f7583-2864-7239-8989-e9afe5db154a"
    ],
    "source": "exo-postgres"
  },
  "metadata": {
    "postgres": {
      "hardware_key": "m5_pro_64_20c",
      "publication_id": "pg-20260827T060320709Z",
      "run_count": 1,
      "source_model_id": "mlx-community/Qwen3.5-9B-MLX-4bit"
    }
  },
  "model_instance_id": "mlx-community-qwen3-5-9b-mlx-4bit--4bit",
  "provenance": {
    "captured_at": "2026-08-27T06:04:13.773Z",
    "sources": [
      {
        "captured_at": "2026-08-27T06:04:13.773Z",
        "kind": "normalized-recipe",
        "url": "https://local.ai"
      }
    ]
  },
  "recipe_source": "exo-postgres",
  "schema_version": "local-ai-registry/v1",
  "serving": {
    "kv_cache_tokens": null,
    "max_concurrency": 1,
    "max_context_tokens": 65600,
    "tensor_parallel": 1
  },
  "speed_sweep_ids": [
    "pg-019f7583-2864-7239-8989-e9afe5db154a-sweep"
  ],
  "status": "candidate"
}
